{
  "version": "0.4.4-phase4-seed-scaffold",
  "status": "unvalidated_expert_stub",
  "science_lock": "SCIENCE_LOCKS_v0.4_phase1_2.md§Phase4",
  "never_mix_domains": true,
  "suitability_neq_confidence": true,
  "writes_to_app_public": false,
  "mountain_partner_ui": false,
  "forbidden": [
    "campaign_ha",
    "seed_kg",
    "crew_days",
    "operational_truth",
    "pest_certainty",
    "soil_moisture_percent",
    "live_khareef_onset",
    "cross_domain_recommend",
    "auto_campaign_planner"
  ],
  "rows": [
    {
      "site_ref": "AOU-NJ-000001",
      "domain": "agriculture_aou",
      "species_id": "ziziphus_spina_christi",
      "species_name_sci": "Ziziphus spina-christi",
      "suitability_provisional_0_100": null,
      "status": "unvalidated_expert_stub",
      "evidence_gaps": [
        "authority_short_list_pending",
        "no_field_validation",
        "species_suitability_unvalidated",
        "no_campaign_quantities_by_design",
        "no_aou_ground_truth_species",
        "site_ref=AOU-NJ-000001"
      ],
      "species_suitability": {
        "status": "unvalidated",
        "score_0_100": null,
        "note_en": "Matrix scaffold only — unvalidated; not operational truth.",
        "note_ar": "هيكل مصفوفة فقط — غير مُتحقَّق؛ ليست حقيقة تشغيلية."
      },
      "seed_recommendation": {
        "mode": "manual",
        "operator_confirmed": false,
        "recommendation_text_en": null,
        "recommendation_text_ar": null,
        "note_en": "Manual / operator-confirmed only — no auto recommend."
      },
      "timing_window": {
        "kind": "calendar_heuristic",
        "status": "provisional",
        "window_label_en": "Najd cool-season heuristic (approx Nov–Mar) — provisional calendar only",
        "window_label_ar": "إرشاد موسم نجد البارد (تقريباً نوفمبر–مارس) — تقويم مؤقت فقط",
        "note_en": "Calendar heuristic provisional — not phenology engine output; not live onset.",
        "live_khareef_onset": false
      },
      "seed_provenance": {
        "local_preferred": true,
        "provenance_status": "local_preferred_flag_only",
        "note_en": "local_preferred flag only — not a verified lot certificate."
      },
      "seeding_protocol": {
        "mode": "manual_operator_confirmed",
        "steps": [
          "authority_contact",
          "site_field_check",
          "species_confirm",
          "provenance_confirm",
          "timing_confirm",
          "protocol_confirm",
          "operator_signoff",
          "defer_insufficient_evidence"
        ],
        "auto_assign": false,
        "note_en": "Enum steps only; operator must confirm. No auto campaign planner."
      }
    },
    {
      "site_ref": "AOU-NJ-000001",
      "domain": "agriculture_aou",
      "species_id": "vachellia_tortilis",
      "species_name_sci": "Vachellia tortilis",
      "suitability_provisional_0_100": null,
      "status": "unvalidated_expert_stub",
      "evidence_gaps": [
        "authority_short_list_pending",
        "no_field_validation",
        "species_suitability_unvalidated",
        "no_campaign_quantities_by_design",
        "no_aou_ground_truth_species",
        "site_ref=AOU-NJ-000001"
      ],
      "species_suitability": {
        "status": "unvalidated",
        "score_0_100": null,
        "note_en": "Matrix scaffold only — unvalidated; not operational truth.",
        "note_ar": "هيكل مصفوفة فقط — غير مُتحقَّق؛ ليست حقيقة تشغيلية."
      },
      "seed_recommendation": {
        "mode": "manual",
        "operator_confirmed": false,
        "recommendation_text_en": null,
        "recommendation_text_ar": null,
        "note_en": "Manual / operator-confirmed only — no auto recommend."
      },
      "timing_window": {
        "kind": "calendar_heuristic",
        "status": "provisional",
        "window_label_en": "Najd cool-season heuristic (approx Nov–Mar) — provisional calendar only",
        "window_label_ar": "إرشاد موسم نجد البارد (تقريباً نوفمبر–مارس) — تقويم مؤقت فقط",
        "note_en": "Calendar heuristic provisional — not phenology engine output; not live onset.",
        "live_khareef_onset": false
      },
      "seed_provenance": {
        "local_preferred": true,
        "provenance_status": "local_preferred_flag_only",
        "note_en": "local_preferred flag only — not a verified lot certificate."
      },
      "seeding_protocol": {
        "mode": "manual_operator_confirmed",
        "steps": [
          "authority_contact",
          "site_field_check",
          "species_confirm",
          "provenance_confirm",
          "timing_confirm",
          "protocol_confirm",
          "operator_signoff",
          "defer_insufficient_evidence"
        ],
        "auto_assign": false,
        "note_en": "Enum steps only; operator must confirm. No auto campaign planner."
      }
    },
    {
      "site_ref": "AOU-NJ-000001",
      "domain": "agriculture_aou",
      "species_id": "prosopis_cineraria",
      "species_name_sci": "Prosopis cineraria",
      "suitability_provisional_0_100": null,
      "status": "unvalidated_expert_stub",
      "evidence_gaps": [
        "authority_short_list_pending",
        "no_field_validation",
        "species_suitability_unvalidated",
        "no_campaign_quantities_by_design",
        "no_aou_ground_truth_species",
        "site_ref=AOU-NJ-000001"
      ],
      "species_suitability": {
        "status": "unvalidated",
        "score_0_100": null,
        "note_en": "Matrix scaffold only — unvalidated; not operational truth.",
        "note_ar": "هيكل مصفوفة فقط — غير مُتحقَّق؛ ليست حقيقة تشغيلية."
      },
      "seed_recommendation": {
        "mode": "manual",
        "operator_confirmed": false,
        "recommendation_text_en": null,
        "recommendation_text_ar": null,
        "note_en": "Manual / operator-confirmed only — no auto recommend."
      },
      "timing_window": {
        "kind": "calendar_heuristic",
        "status": "provisional",
        "window_label_en": "Najd cool-season heuristic (approx Nov–Mar) — provisional calendar only",
        "window_label_ar": "إرشاد موسم نجد البارد (تقريباً نوفمبر–مارس) — تقويم مؤقت فقط",
        "note_en": "Calendar heuristic provisional — not phenology engine output; not live onset.",
        "live_khareef_onset": false
      },
      "seed_provenance": {
        "local_preferred": true,
        "provenance_status": "local_preferred_flag_only",
        "note_en": "local_preferred flag only — not a verified lot certificate."
      },
      "seeding_protocol": {
        "mode": "manual_operator_confirmed",
        "steps": [
          "authority_contact",
          "site_field_check",
          "species_confirm",
          "provenance_confirm",
          "timing_confirm",
          "protocol_confirm",
          "operator_signoff",
          "defer_insufficient_evidence"
        ],
        "auto_assign": false,
        "note_en": "Enum steps only; operator must confirm. No auto campaign planner."
      }
    },
    {
      "site_ref": "AOU-NJ-000001",
      "domain": "agriculture_aou",
      "species_id": "irrigated_fodder_placeholder",
      "species_name_sci": "irrigated_fodder_placeholder",
      "suitability_provisional_0_100": null,
      "status": "unvalidated_expert_stub",
      "evidence_gaps": [
        "authority_short_list_pending",
        "no_field_validation",
        "species_suitability_unvalidated",
        "no_campaign_quantities_by_design",
        "no_aou_ground_truth_species",
        "site_ref=AOU-NJ-000001"
      ],
      "species_suitability": {
        "status": "unvalidated",
        "score_0_100": null,
        "note_en": "Matrix scaffold only — unvalidated; not operational truth.",
        "note_ar": "هيكل مصفوفة فقط — غير مُتحقَّق؛ ليست حقيقة تشغيلية."
      },
      "seed_recommendation": {
        "mode": "manual",
        "operator_confirmed": false,
        "recommendation_text_en": null,
        "recommendation_text_ar": null,
        "note_en": "Manual / operator-confirmed only — no auto recommend."
      },
      "timing_window": {
        "kind": "calendar_heuristic",
        "status": "provisional",
        "window_label_en": "Najd cool-season heuristic (approx Nov–Mar) — provisional calendar only",
        "window_label_ar": "إرشاد موسم نجد البارد (تقريباً نوفمبر–مارس) — تقويم مؤقت فقط",
        "note_en": "Calendar heuristic provisional — not phenology engine output; not live onset.",
        "live_khareef_onset": false
      },
      "seed_provenance": {
        "local_preferred": false,
        "provenance_status": "authority_pending",
        "note_en": "local_preferred flag only — not a verified lot certificate."
      },
      "seeding_protocol": {
        "mode": "manual_operator_confirmed",
        "steps": [
          "authority_contact",
          "site_field_check",
          "species_confirm",
          "provenance_confirm",
          "timing_confirm",
          "protocol_confirm",
          "operator_signoff",
          "defer_insufficient_evidence"
        ],
        "auto_assign": false,
        "note_en": "Enum steps only; operator must confirm. No auto campaign planner."
      }
    },
    {
      "site_ref": "AOU-NJ-000002",
      "domain": "agriculture_aou",
      "species_id": "ziziphus_spina_christi",
      "species_name_sci": "Ziziphus spina-christi",
      "suitability_provisional_0_100": null,
      "status": "unvalidated_expert_stub",
      "evidence_gaps": [
        "authority_short_list_pending",
        "no_field_validation",
        "species_suitability_unvalidated",
        "no_campaign_quantities_by_design",
        "no_aou_ground_truth_species",
        "site_ref=AOU-NJ-000002"
      ],
      "species_suitability": {
        "status": "unvalidated",
        "score_0_100": null,
        "note_en": "Matrix scaffold only — unvalidated; not operational truth.",
        "note_ar": "هيكل مصفوفة فقط — غير مُتحقَّق؛ ليست حقيقة تشغيلية."
      },
      "seed_recommendation": {